{
  "id": "a1b2c3d4-e5f6-7890-abcd-ef1234567890",
  "name": "Production Tenant",
  "kind": "root",
  "enabled": true,
  "parent_id": "a1b2c3d4-e5f6-7890-abcd-ef1234567890",
  "customer_type": "default",
  "created_at": "2025-03-15T14:30:00Z",
  "updated_at": "2025-03-15T14:30:00Z",
  "version": 1,
  "contact": "sample-value"
}